Title,Date
"1 năm hôn nhân của Midu, điều hấp dẫn nhất lại chính là... thiếu gia Minh Đạt",22-05-2025 - 10:25 AM
"Midu và mẹ chồng: Mối quan hệ từng gây xôn xao, 1 hành động diễn ra trong lễ cưới lộ rõ cách cư xử",27-04-2025 - 09:35 AM
"Chồng thiếu gia của Midu không để ý có camera lia trúng, liên tục làm 1 hành động lạ giữa sự kiện",08-04-2025 - 20:58 PM
Cuộc sống như mơ của Midu sau khi cưới thiếu gia tập đoàn nhựa,04-04-2025 - 21:17 PM
"Giám đốc nhựa Duy Tân chi nhánh Mỹ và cô vợ nhỏ Midu gây ""nổ mạng"": Ngôn tình cũng đến cỡ này thôi",03-04-2025 - 13:55 PM
"Midu khoe clip du lịch Trung Quốc: Visual chồng thiếu gia thành tâm điểm, lộ 1 hành động siêu mê vợ!",29-03-2025 - 20:55 PM
"Midu quay toàn cảnh trong biệt thự, nhưng diện mạo ở nhà của thiếu gia Minh Đạt mới là điều hấp dẫn",11-03-2025 - 07:14 AM
"Midu để lộ cận body hiện tại, soi đúng bàn tay có hành động lạ giữa nghi vấn bầu bí",05-03-2025 - 07:38 AM
"Midu - Đỗ Mỹ Linh: 2 nàng dâu hào môn cứ xuất hiện là gây sốt, cuộc sống hôn nhân có điều khác biệt",19-02-2025 - 08:20 AM
"Bắt trọn cảnh Midu thẳng tay vứt cả bó hoa to đùng vào thùng rác, danh tính người tặng gây ngỡ ngàng",16-02-2025 - 18:50 PM
"Midu mất túi và 120 triệu ở nước ngoài căng như phim: Trích xuất camera ly kỳ, thứ hiện ra bên trong túi khi cảnh sát tìm thấy gây sốc!",10-02-2025 - 07:45 AM
Midu trở thành tâm điểm chú ý vì một chi tiết lạ,05-02-2025 - 10:33 AM
"Midu tung loạt ảnh chấn động visual mùng 1 Tết, phát hiện sự thay đổi của thiếu gia Minh Đạt sau gần 1 năm kết hôn",29-01-2025 - 23:00 PM
"Hội dâu hào môn ngày đầu năm Ất Tỵ: Mai Ngọc khoe bụng bầu vượt mặt, Midu và chồng thiếu gia tình tứ trên phố",29-01-2025 - 22:00 PM
1 câu nói của Midu vô tình hé lộ về cuộc sống thật với thiếu gia Minh Đạt,17-01-2025 - 10:10 AM
Diện mạo lạ lẫm gây chú ý của chồng Midu,08-01-2025 - 16:35 PM
"Midu và hội bạn thân mở tiệc riêng tư, thiếu gia Minh Đạt để lộ 1 hành động lạ ngay khi không ai chú ý",24-12-2024 - 11:27 AM
"Midu tung ảnh đính chính 1 tin đồn, để lộ thông tin đặc biệt liên quan chồng thiếu gia",20-12-2024 - 13:45 PM
Sai lầm của Midu,09-12-2024 - 21:33 PM
Điều bí ẩn sau nửa năm diễn ra hôn lễ của Midu và chồng thiếu gia,28-10-2024 - 20:41 PM
"Midu bỗng hóa thần tiên tỷ tỷ, khiến fan nam sững sờ",22-10-2024 - 23:40 PM
"Midu U40 ngày càng thăng hạng nhan sắc, vóc dáng thon gọn đáng ngưỡng mộ nhờ 1 bộ môn nhiều mỹ nhân Việt yêu thích",15-10-2024 - 23:26 PM
Hiếm lắm mới Midu mới tiết lộ cuộc sống vợ chồng son với thiếu gia Minh Đạt trong căn hộ cao cấp,07-10-2024 - 09:10 AM
"Midu đón sinh nhật bên hội bạn thân, nhưng bị ông xã Minh Đạt giật spotlight vì 1 hành động",06-10-2024 - 18:36 PM
"Midu lẻ bóng ở đám cưới Anh Đức, lộ nhan sắc thật qua ""cam thường""",11-09-2024 - 14:30 PM
Midu thăng hạng nhan sắc là nhờ chồng thiếu gia làm điều này?,11-09-2024 - 09:53 AM
"Không còn nghỉ dưỡng sang chảnh, Midu và chồng thiếu gia chọn địa điểm có giá chỉ gần 2 triệu/đêm mà cảnh lại quá đẹp đậm chất Việt Nam",04-09-2024 - 11:07 AM
"Midu bị bắt gặp đi nghỉ dưỡng, thái độ khác biệt của chồng đại gia gây chú ý",02-09-2024 - 20:18 PM
"Chồng thiếu gia của Midu bị soi khoảnh khắc nói ""liến thoắng"" khi ngồi xem show thời trang",27-08-2024 - 17:28 PM
"Vợ chồng Midu tình tứ, cùng dàn sao Việt đi xem show Chung Thanh Phong",27-08-2024 - 09:24 AM
Chồng thiếu gia và Midu gây chú ý vì hành động này khi xuất hiện trên đường,26-08-2024 - 11:10 AM
"Midu bất ngờ tiết lộ về những đố kị, ganh ghét",16-08-2024 - 12:14 PM
"Tổng tài Minh Đạt gây sốt khi xuất hiện tại lễ nhận bằng thạc sĩ của vợ, Midu đã có tất cả trong tay!",11-08-2024 - 15:54 PM
"Chồng thiếu gia của Midu ""giật spotlight"" trong sinh nhật Mai Phương Thuý",10-08-2024 - 20:36 PM
Từ khóa tìm kiếm về Midu gây bức xúc,07-08-2024 - 09:14 AM
"Midu quay lén 12 giây chồng thiếu gia làm điều này cho vợ: Lập tức lên xu hướng, hút 2 triệu view chỉ sau chưa đầy 24 giờ đăng tải",02-08-2024 - 10:15 AM
Midu hiếm hoi dự sự kiện vắng bóng chồng thiếu gia,30-07-2024 - 15:18 PM
"Midu không sống chung với bố mẹ chồng, hé lộ không gian nhà tân hôn hoành tráng với thiếu gia Minh Đạt",19-07-2024 - 07:16 AM
Đám cưới Anh Đức và vợ kém 12 tuổi có 1 quy định gây tranh cãi giống hôn lễ hào môn của Midu,18-07-2024 - 08:28 AM
"Midu cùng dàn sao khoe thiệp cưới nam diễn viên đình đám, dự sẽ có nửa Vbiz tụ họp!",17-07-2024 - 17:35 PM
"Midu ""xả vai"" đi dạy trẻ ngang sinh viên, tiết lộ không đeo nhẫn cưới vì lý do đặc biệt",17-07-2024 - 07:36 AM
Nơi bắt đầu cuộc tình hào môn Midu - Minh đạt: Du thuyền sang trọng nhưng chi phí hợp lý,15-07-2024 - 21:15 PM
Midu tiết lộ tính cách của chồng thiếu gia sau nửa tháng về chung một nhà,15-07-2024 - 05:38 AM
Độc lạ ”đám cưới bê tráp bằng kiệu của đại gia Đắk Nông”: Cô dâu học hỏi Midu 1 điều!,14-07-2024 - 17:40 PM
Lộ ảnh hiếm của Midu và thiếu gia Minh Đạt hồi còn yêu đương bí mật,12-07-2024 - 15:12 PM
Midu bị soi chi tiết lạ hậu đám cưới hào môn,10-07-2024 - 20:26 PM
"Midu lộ diện tại TP.HCM sau chuyến trăng mật với chồng thiếu gia, vòng 2 của cô gây chú ý",10-07-2024 - 15:33 PM
"Choáng ngợp với BTS túi hiệu của nàng dâu tập đoàn nhựa ""nghìn tỷ"" Midu: Có chiếc hơn nửa tỷ đồng",10-07-2024 - 00:11 AM
"Doanh nghiệp nhựa nhà Ông Cao Thắng, Minh Nhựa, chồng Midu kinh doanh ra sao?",09-07-2024 - 10:27 AM
Midu có phản hồi lạ khi được chúc “đi 2 về 3” trong tuần trăng mật sang chảnh,08-07-2024 - 15:10 PM
"Chồng thiếu gia của Midu cưng vợ ra mặt khi hẹn hò, lần đầu để lộ nhẫn cưới",07-07-2024 - 20:08 PM
Sâu sắc như Midu: Mặc đúng chiếc váy gặp Minh Đạt trên du thuyền vào đêm đầu tiên thành vợ chồng,07-07-2024 - 12:05 PM
"Hé lộ cuộc gặp gỡ định mệnh của Midu - Minh Đạt vào 3 năm trước, Lan Ngọc và dàn sao Vbiz chứng kiến",06-07-2024 - 06:53 AM
"Chồng Midu khoe body vạm vỡ, ôm chầm vợ trong chuyến đi tuần trăng mật",05-07-2024 - 07:10 AM
Midu xin netizen đừng chỉ trích vì 1 hành động sau đám cưới,04-07-2024 - 10:22 AM
"""Bóc"" giá resort Midu và chồng đi trăng mật: Lên tới 240 triệu/đêm, được mệnh danh là ""đắt nhất Việt Nam""",04-07-2024 - 09:12 AM
Chưa Biết thua kiện Midu?,04-07-2024 - 08:34 AM
Lộ địa điểm Midu hưởng tuần trăng mật sang chảnh,04-07-2024 - 07:50 AM
Khối tài sản chung hàng trăm tỷ của Midu và thiếu gia Minh Đạt,03-07-2024 - 14:55 PM
"Em trai thiếu gia Minh Đạt bế vợ khiêu vũ trong hôn lễ của Midu, khí chất hào môn ngập tràn",02-07-2024 - 17:35 PM
Chuyện gì đang xảy ra giữa Midu và Harry Lu?,02-07-2024 - 13:43 PM
"Một sao nam Vbiz nói đồ ăn ở đám cưới Midu quá ít, ""không đủ dính răng"" nhưng mukbang thì vô cùng nhiệt tình",02-07-2024 - 11:06 AM
Lý do Mai Phương Thúy mang dép bệt đi ăn cưới Midu,01-07-2024 - 20:07 PM
"Khu biệt thự nhà chồng Midu: Nơi sống của giới nhà giàu tinh hoa, vài trăm tỷ/căn nhưng không có cổng",01-07-2024 - 14:50 PM
"Dàn sao dự đám cưới Midu “ăn điểm” khi diện váy trắng đẹp, sang mà không lấn lướt cô dâu",01-07-2024 - 14:22 PM
Minh Hằng đáp trả khi bị nói là “con giáp thứ 13” và giật spotlight của Midu,01-07-2024 - 12:35 PM
Phát hiện 1 sao nữ Vbiz làm trái quy định khi đến dự cưới Midu và Minh Đạt?,01-07-2024 - 09:33 AM
"Tóm dính vợ chồng Midu hậu đám cưới hào môn, thái độ cô dâu với chú rể gây chú ý",01-07-2024 - 07:55 AM
"Mỹ nhân được bạn trai bế thốc để giật hoa cưới Midu, lộ hint muốn cưới dù chưa công khai?",01-07-2024 - 07:05 AM
"Thiếu gia Minh Đạt: ""Với tôi, một đời này vẫn chưa đủ để yêu Midu""",30-06-2024 - 21:52 PM
"Ý kiến được thảo luận rôm rả nhất hiện tại: Midu chọn chồng là oke nhất, còn váy - hoa - makeup thì...",30-06-2024 - 19:20 PM
"5 chi tiết đậm mùi hào môn trong đám cưới Midu: Màn cắt bánh ""độc nhất vô nhị"" chưa khủng bằng việc dùng 1 thứ đắt nhất thế giới!",30-06-2024 - 19:00 PM
2 khách mời lao vào tranh giành hoa cưới đến tả tơi trong đám cưới của Midu gây tranh cãi,30-06-2024 - 10:35 AM
"Đám cưới Midu: Lan Ngọc bất ngờ lộ diện, Mai Phương Thúy hối hả, vợ chồng Trường Giang và nửa showbiz tề tựu",30-06-2024 - 09:35 AM
"Cô dâu Midu thay tới 4 bộ váy lộng lẫy thì chú rể Minh Đạt cũng có hẳn 2 bộ lễ phục, đứng cạnh nhau mà visual tràn màn hình",30-06-2024 - 09:29 AM
"Thiếu gia Minh Đạt khóc nức nở thề nguyện với Midu: Anh hứa nhường em, cho em làm ""nóc nhà""!",30-06-2024 - 08:23 AM
"Bị ""giật"" chú rể Minh Đạt ngay giữa đám cưới, Midu có thái độ thế nào?",30-06-2024 - 08:18 AM
"Full clip Midu bước vào lễ đường: Thiếu gia Minh Đạt nhìn vợ nghẹn ngào, lời phát biểu của cô dâu cực xúc động",30-06-2024 - 08:02 AM
Vì sao dâu hào môn Midu chọn hoa cưới cầm tay có 1 loại dây leo quen thuộc trong vườn nhà?,30-06-2024 - 07:27 AM
"Midu và Minh Đạt chính thức lộ diện, mẹ chồng có thái độ gây chú ý bên cạnh con dâu",29-06-2024 - 20:50 PM
"Menu tiệc cưới của ""phú bà"" Midu và ""tổng tài"" Minh Đạt được hé lộ: Toàn nguyên liệu nhà giàu, có thứ được ví như kim cương",29-06-2024 - 20:01 PM
"Đám cưới hào môn Midu - Minh Đạt: Cô dâu xinh xắn lộ diện bên mẹ chồng quyền lực, visual chú rể quá đỉnh!",29-06-2024 - 19:39 PM
Midu và thiếu gia Minh Đạt đã tạo ra đám cưới xa hoa bậc nhất Vbiz nửa đầu năm 2024 như thế nào?,29-06-2024 - 17:06 PM
"Độc quyền bên trong đám cưới Midu: Thiếu gia Minh Đạt sẽ làm 1 điều độc đáo, không gian xa hoa được hé lộ",29-06-2024 - 14:55 PM
"Midu ""nhá hàng"" bộ ảnh cưới cuối cùng ngay trước giờ G: Cô dâu - chú rể ngọt ngào khiến netizen ""phát hờn""",29-06-2024 - 12:00 PM
"Vợ chồng Midu tặng quà cho 28 người bê tráp: Chi hơn 100 triệu đồng, nội dung bức thư đi kèm gây chú ý",28-06-2024 - 13:46 PM
"Hé lộ không gian đám cưới xa hoa của Midu - Minh Đạt: Cô dâu phải di chuyển bằng scooter vì quá rộng, thi công 4 ngày 4 đêm",28-06-2024 - 07:35 AM
"2 ngày trước hôn lễ, Midu tung trọn bộ ảnh cưới: Cô dâu mỹ miều bên chồng trẻ, 1 chi tiết đắt đỏ gây chú ý",27-06-2024 - 15:33 PM
"Midu tung ảnh cưới siêu ngọt ngào, biểu cảm của chồng thiếu gia gây chú ý",25-06-2024 - 15:10 PM
Lộ diện 2 cặp tình nhân trong lễ vu quy của Midu và thiếu gia Minh Đạt: Một couple từng chia tay rồi quay lại,24-06-2024 - 18:08 PM
"Vừa dắt tay Midu bước vào biệt thự hào môn, mẹ thiếu gia Minh Đạt loay hoay làm 1 hành động gây bất ngờ",24-06-2024 - 15:03 PM
"Khoảnh khắc ""full HD"" toàn cảnh lễ vu quy Midu - Minh Đạt: Dâu rể gấp đôi visual, lộ loạt chi tiết hào môn gây sốt",24-06-2024 - 07:45 AM
"Menu tiệc đám hỏi Midu: Tổ chức ở khách sạn 5 sao, toàn món chất lượng nhưng lại ""thiếu thiếu gì đó""",23-06-2024 - 20:55 PM
"Trọn vẹn ảnh và clip thiếu gia Minh Đạt ""khoá môi"" Midu cực ngọt ngào trong lễ vu quy",23-06-2024 - 20:02 PM
Lễ vu quy Midu: Dàn sính lễ và thái độ nhà chồng thiếu gia gây chú ý,23-06-2024 - 14:50 PM
"Lễ vu quy Midu và Minh Đạt: Cô dâu chú rể trao ánh mắt tình tứ, hành động nam thiếu gia với nhà vợ gây chú ý!",23-06-2024 - 09:36 AM
"Địa điểm tổ chức đám cưới của Midu và thiếu gia Minh Đạt: Nơi đang hot gần đây, được đại gia, sao Việt ""chấm""",22-06-2024 - 21:17 PM
"Midu ""quay xe"" phút chót, mời Harry Lu vào vị trí đặc biệt trong lễ ăn hỏi với chồng thiếu gia",22-06-2024 - 16:26 PM
"""Rừng sao Vbiz"" dự đổ bộ đám cưới Midu và thiếu gia Minh Đạt: Mai Phương Thúy - Harry Lu sẵn sàng, số lượng đội bê tráp gây choáng!",22-06-2024 - 14:41 PM
"Đám hỏi hào môn của Midu và thiếu gia Minh Đạt: Hé lộ dàn bê tráp 29 người, Harry Lu tiếp tục ""vắng bóng""!",20-06-2024 - 21:35 PM
