Title,Date
"Thời trang đi du lịch của Minh Hằng đẹp từ năm này qua năm khác, phụ nữ U40 nên tham khảo",2025-05-11T23:35:00
"Vòng eo con kiến ""đốt mắt"" của Minh Hằng, cường độ tập luyện ""đỉnh chóp"" giúp body mẹ bỉm như thuở đôi mươi",2025-04-30T21:39:00
"Soi visual dàn Chị Đẹp tổng duyệt concert: Minh Hằng tươi rói sáng bừng, Diệu Nhi lộ dấu hiệu tăng cân",2025-04-12T12:39:00
"Hơn 40 sao hot Vbiz đổ bộ tổng duyệt concert Chị Đẹp: Minh Hằng khoe quý tử, 1 người ""cấm cửa"" bạn trai đến xem",2025-04-12T08:00:00
"Minh Hằng hack dáng ""sang xịn mịn"" cực đỉnh, nhờ 1 món đồ mà ai cũng khen",2025-04-11T22:00:00
Minh Hằng bất ngờ khi được chồng tặng ôtô,2025-03-17T21:03:00
"Chồng doanh nhân hơn 10 tuổi của Minh Hằng bị soi dấu hiệu lạ, vắng mặt bất thường trong ngày quan trọng",2025-03-10T18:02:00
"Minh Hằng dạo này: Xuống phố hay đi du lịch đều mặc quá đẹp, chị em lại có thêm ý tưởng phối đồ từ xuân sang hè",2025-03-07T06:29:00
"Hội bạn xinh - giỏi - quyền lực nhất Vbiz: Đông Nhi - Minh Hằng khoe sắc ""đỉnh chóp"", Hoàng Thuỳ Linh gây ấn tượng vì phong cách đặc biệt",2025-03-01T07:29:00
"Ồn ào giữa Hồ Ngọc Hà - Minh Hằng, vì sao 8 năm qua vẫn ""nóng""?",2025-01-25T20:24:00
Chuyện gì xảy ra giữa Hồ Ngọc Hà và Minh Hằng?,2025-01-24T21:29:00
Minh Hằng phản ứng thế nào khi ồn ào với Hà Hồ bị đào lại?,2025-01-24T21:08:00
"HOT: Minh Hằng chính thức lên tiếng ồn ào tái hợp với Hồ Ngọc Hà: ""Em không sai, chị cũng không sai""",2025-01-24T18:13:00
Phía sau biểu cảm đứng hình của Hà Hồ khi nghe nhắc tên Minh Hằng,2025-01-24T09:00:00
"Phía Hà Hồ lên tiếng màn ""tái hợp"" với Minh Hằng: Làm rõ thái độ 2 bên, hé lộ loạt chi tiết sốc về ồn ào ""chèn ép"" 7 năm trước!",2025-01-23T22:56:00
"Không phải Trấn Thành - Hà Hồ, đây mới là người đứng sau tiết mục gây bão mạng của Minh Hằng",2025-01-23T21:32:00
"Giữa ồn ào với Minh Hằng, Hồ Ngọc Hà: ""Tôi không đi gây sự và cũng không làm lành với ai""",2025-01-23T12:36:00
"Viral nhất MXH: Trấn Thành nói 1 câu về Minh Hằng làm Hồ Ngọc Hà ""sượng trân đứng hình""",2025-01-23T00:12:00
"Minh Hằng làm náo loạn MXH vì khoảnh khắc chơi bida cực hot, zoom cận càng sexy!",2025-01-21T19:24:00
"Minh Hằng ngày càng trẻ đẹp, visual phát sáng tại WeChoice nhờ chăm giữ dáng: Từng giảm 10kg trong 3 tháng, thực đơn hóa ra rất dễ tuân thủ",2025-01-20T15:30:00
"Thảm đỏ hot nhất hôm nay: Minh Hằng - Tóc Tiên so kè visual quá gắt, 1 mỹ nhân khoe body cực cháy lấn át dàn Hoa hậu",2025-01-18T21:46:00
"Khoảnh khắc lịch sử: Minh Hằng chạm mặt đàn chị từng thân khi trình diễn WeChoice, phản ứng của cả 2 gây bất ngờ",2025-01-15T15:56:00
"Màn biến hình chưa từng có của Minh Hằng tại WeChoice Awards, xử lý tình huống mượt mà thế này!",2025-01-14T13:27:00
"JustaTee nói một câu gây sốc khiến chị đẹp Minh Hằng cười ""hết hồn""",2025-01-13T18:35:00
"Gil Lê chính thức bị loại trước thềm Chung kết Chị đẹp đạp gió: Minh Hằng sốc, Ngọc Phước tức 1 chuyện!",2025-01-12T07:00:00
"Không khí cực nóng tổng duyệt WeChoice Awards 2024: Minh Hằng thần thái ngút ngàn, dàn Chị Đẹp đọ visual ""khét lẹt""",2025-01-12T01:22:00
"Tổng duyệt Gala WeChoice 2024: 1 Chị Đẹp tranh thủ ăn mì lấy sức, Minh Hằng visual cam thường quá đỉnh!",2025-01-12T01:06:00
"Minh Tuyết, Minh Hằng sốc với kết quả công diễn 5 ""Chị đẹp đạp gió 2024""",2025-01-10T17:31:00
1 Chị đẹp liên tục vướng tranh cãi lộ hint đã bị hội Tóc Tiên - Minh Hằng cho ra rìa?,2025-01-08T20:00:00
"Camera bắt cận cảnh chồng giấu mặt của Minh Hằng đi ""giám sát"" vợ, phản ứng sau đó gây chú ý",2024-12-23T10:30:00
"Sân khấu đỉnh nhất Chị Đẹp 2024: Trọn vẹn cả hình ảnh, âm thanh lẫn diễn xuất, Minh Hằng ""xuyên không"" về thời ""bé Heo""",2024-12-22T10:15:00
Minh Hằng: “Tôi không ngại đồn đoán ở Chị Đẹp vì khán giả ngày nay rất thông minh”,2024-12-11T18:13:00
"Minh Hằng - Tóc Tiên làm điều gây sốc, hành động của Minh Tuyết đằng sau càng gây tranh cãi",2024-12-08T14:20:00
"Không được làm đội trưởng, Minh Hằng thảnh thơi ngồi bóc túi mù",2024-12-08T11:24:00
"Chị đẹp Châu Tuyết Vân lần thứ 5 vô địch taekwondo thế giới, Tóc Tiên, Minh Hằng liền có phản ứng này",2024-12-03T10:18:00
"Minh Hằng đã làm tốt rồi, đừng áy náy!",2024-12-02T21:00:00
"Phản ứng gây bão mạng của Minh Hằng khi liên tục thua cuộc, mất 2 thành viên",2024-12-01T20:01:00
"Chị đẹp đạp gió: 2 chị đẹp bị loại, sốc trước kết quả của đội Minh Hằng",2024-12-01T07:08:00
"Minh Hằng: ""Chồng hay rủ tôi đi tiệc cùng, chắc cũng tự hào cũng muốn khoe tôi đấy!""",2024-11-28T00:33:00
"Minh Hằng: “Tôi và Tóc Tiên dặn nhau phải bình tĩnh, đừng để xảy ra những điều đáng tiếc”",2024-11-27T19:04:00
"Minh Hằng: ""Phần thi của tôi ai cũng khen đẹp, ca sĩ mà khen đẹp vậy hát không ok hả?""",2024-11-27T00:02:00
"Mẹ ác ma, cha thiên sứ: Minh Hằng khó khăn khi phải hóa thân thành bà mẹ “ác ma”!",2024-11-26T08:00:00
"Tóc Tiên bị từ chối, Minh Hằng là chị đẹp được yêu thích nhất",2024-11-24T14:00:00
"Sốc nhất Chị Đẹp Đạp Gió: Minh Hằng từ chối Mỹ Linh, thái độ sau đó mới đáng nói",2024-11-24T00:04:00
Khả năng ca hát của Minh Hằng so với Tóc Tiên ra sao?,2024-11-22T08:00:00
Minh Hằng: Tôi và Tóc Tiên có những cuộc chiến trên bài hát chứ không phải đố kỵ,2024-11-20T13:00:00
"""Chị đẹp"" Minh Hằng khoe vai trần quyến rũ: Bí quyết giúp U40 một con trẻ như 20 hóa ra từ 1 loại nước uống",2024-11-19T07:24:00
Lộ khung hình nhạy cảm gây tranh cãi của Minh Hằng,2024-11-18T00:05:00
Xuân Nghi đánh bại Minh Hằng,2024-11-17T07:53:00
"Mê mẩn style diện váy trẻ xinh và tôn dáng của ""chị đẹp"" Minh Hằng",2024-11-10T22:06:00
Chị đẹp đạp gió tập 3: Minh Hằng giỏi thế nào mà khiến Phương Thanh phải nói câu này?,2024-11-10T12:05:00
"Minh Hằng, Tóc Tiên rơi vào thế khó khi hiểu sai luật chơi Chị Đẹp Đạp Gió",2024-11-10T12:00:00
Minh Hằng xin lỗi các chị đẹp,2024-11-10T09:28:00
"Kết quả FADO Fancy Pickleball người nổi tiếng: Học trò Minh Hằng là Quán quân, “trò cưng” Hà Hồ về nhì!",2024-11-03T20:33:00
Minh Hằng lần đầu lên tiếng về thái độ thiếu thân thiện trên sóng truyền hình,2024-11-03T14:07:00
Chuyện gì đã xảy ra với Minh Hằng và Phạm Quỳnh Anh?,2024-10-28T18:07:00
Thái độ kém thân thiện gây tranh cãi của Minh Hằng ở tập 1 Chị đẹp Đạp gió,2024-10-27T15:31:00
"""Chị đẹp đạp gió"" lên sóng: Minh Hằng - Tóc Tiên đẹp như nữ thần nhưng spotlight lại thuộc về đàn chị cấp S này",2024-10-27T09:32:00
"Tóc Tiên ở tập 1 Đạp gió 2024: Bật khóc thừa nhận 1 điều, bị Minh Hằng nghi ngờ và khiến 1 chị đẹp ""bức xúc""",2024-10-27T00:00:00
"Tập 1 Chị đẹp Đạp gió: 1 sao nữ xuất hiện khiến dàn chị đẹp nhận không ra, Minh Hằng ""xịt keo"" nói ngay câu này!",2024-10-26T22:28:00
"30 Chị Đẹp ra MV được khen ""nó Hàn Quốc, nó Âu Mỹ"": Minh Hằng xinh như tiên tử vẫn bị 1 người chiếm spotlight!",2024-10-25T10:07:00
Quý tử nhà Minh Hằng lộ diện “đốn tim” tại nhà chung Chị đẹp 2024,2024-10-23T10:03:00
Minh Hằng và bí quyết vượt trầm cảm sau sinh,2024-10-17T21:02:00
1 sao nữ nhất quyết không chịu đứng chung thảm đỏ với Minh Hằng,2024-10-17T19:32:00
Nóng: Tóc Tiên - Minh Hằng lên tiếng tin đồn cạch mặt,2024-10-16T20:28:00
"Thảm đỏ khủng của Chị Đẹp 2024: Minh Hằng - Tóc Tiên đụng độ cực hot, Thiều Bảo Trâm và dàn sao bị 1 nhân vật giật spotlight",2024-10-16T15:08:00
"Loại lá tốt ngang ""kem chống nắng tự nhiên"", sản sinh collagen giúp Minh Hằng, Tóc Tiên chống lão hóa, giảm cân thần tốc",2024-10-16T07:03:00
Clip 9 giây để lộ thái độ của Minh Hằng và Tóc Tiên,2024-10-14T17:01:00
Chuyện gì đang xảy ra với Minh Hằng - Tóc Tiên?,2024-10-14T09:05:00
"Minh Hằng đăng đàn ẩn ý drama ở Chị Đẹp, Tóc Tiên liền có phản ứng",2024-10-12T00:03:00
"10 set đồ trẻ trung nhất của Minh Hằng ở tuổi 37, quý cô U40 nên tham khảo",2024-10-10T23:00:00
"Minh Hằng than thở sau khi quay hình Công diễn 1, show Chị Đẹp 2024 chưa lên sóng đã có drama?",2024-10-10T13:29:00
Một điều tưởng chỉ Jennie làm được thì Minh Hằng cũng có thể!,2024-10-04T14:21:00
"Minh Hằng khoe clip vui, dân tình để ý ngay 2 điểm: Làn da U40 sáng mịn và hộp phấn Nhật giá ""bèo""",2024-09-30T20:28:00
"Minh Hằng làm lộ dàn Chị Đẹp tham gia mùa 2, có một VĐV 5 lần vô địch thế giới",2024-09-06T17:05:00
"Minh Hằng flex ông xã khiến ai cũng ghen tỵ: Thức đêm cho con ăn, ""tranh phần"" bế bé, trông con cho vợ đi làm",2024-09-05T10:22:00
"Cùng tham gia Chị Đẹp mùa 2: Mỹ Linh bị chồng phản đối, Minh Hằng thì trái ngược hoàn toàn",2024-08-31T17:34:00
"Minh Hằng tham gia Chị Đẹp mùa 2, liệu có tái hiện cú nhào lộn ""làm nên thương hiệu""?",2024-08-31T08:29:00
"HOT: Minh Hằng, Thiều Bảo Trâm cùng top 5 Hoa hậu Việt Nam xác nhận tham gia Chị Đẹp mùa 2",2024-08-30T12:10:00
"Cường độ tập luyện ""đỉnh chóp"" của mẹ bỉm Minh Hằng khiến body như thuở đôi mươi, đến Hà Tăng còn phải khen",2024-08-27T22:29:00
Clip: Minh Hằng chăm chú ngồi nghe Hồ Ngọc Hà tâm sự ở sự kiện?,2024-07-31T00:00:00
"Sau Thanh Hằng, Chi Pu, Minh Hằng, nhà sản xuất Will Vũ chính thức có “nàng thơ” mới",2024-07-27T08:00:00
"Lan truyền danh sách Chị Đẹp mùa 2: Minh Hằng, ""tình cũ Sơn Tùng"", 1 cựu hot girl đình đám và rất nhiều cái tên thú vị",2024-07-26T14:00:00
Chồng đại gia của Minh Hằng là ai và tại sao được vợ giấu kín?,2024-07-03T00:04:14
Minh Hằng đáp trả khi bị nói là “con giáp thứ 13” và giật spotlight của Midu,2024-07-01T11:04:00
Minh Hằng tận hưởng cuộc sống viên mãn sau 2 năm kết hôn,2024-06-28T20:27:27
Minh Hằng được ông xã đại gia tặng cả hộp vàng nguyên khối,2024-06-26T19:34:15
"Một môn thể thao 9/10 sao Việt cho con theo học hè này, riêng Minh Hằng còn tự tin tự ""đứng lớp"" mới ghê",2024-06-14T07:49:39
"Con trai Minh Hằng chiếm spotlight vì biểu cảm siêu cưng, độ hot vượt cả mẹ",2024-06-12T18:01:00
"Hot: Jessica đẹp phát sáng, đọ sắc cam thường bên Minh Hằng - Bảo Anh và dàn sao ở TP.HCM",2024-06-06T21:35:00
"Minh Hằng lộ gương mặt ít son phấn, nhan sắc có tụt hạng sau khi sinh?",2024-05-25T16:31:34
"Minh Hằng ở ngưỡng U40: Trải qua sinh nở mà vóc dáng vẫn nóng bỏng, đến thiếu nữ đôi mươi cũng phải ghen tị",2024-05-22T09:30:00
"Minh Hằng, Ngọc Trinh, Tiểu Vy, Tường San khoe sắc bên diện mạo mới của cửa hàng Swarovski Vincom Đồng Khởi",2024-05-21T17:30:00
"Minh Hằng tiết lộ clip ngộ nghĩnh siêu cưng của con trai, netizen nhận xét nhóc tỳ có một điểm giống mẹ y đúc",2024-05-19T11:32:00
"Bí quyết giúp Minh Tú, Minh Hằng thăng hạng nhan sắc trong ngày cưới",2024-05-16T10:00:00
"Minh Hằng sau 2 năm lấy chồng đại gia: Nhan sắc thăng hạng, sinh con trai bụ bẫm",2024-05-14T09:43:08
"Con trai Minh Hằng lộ diện gây sốt, biểu cảm ""ngoan xinh yêu"" nhận bão tim",2024-05-11T12:03:59
Bí quyết đẹp lại sau sinh của Minh Hằng,2024-05-09T12:02:00
"Minh Hằng đưa quý tử du lịch, sắc vóc mẹ bỉm sau 8 tháng sinh nở gây sốt",2024-05-04T20:03:00
"Minh Hằng chia sẻ lý do không phải làm dâu, tiết lộ mối quan hệ với nhà chồng hào môn",2024-05-01T21:27:44
"Minh Hằng: ""Tôi rất sợ và dè chừng anh Trấn Thành""",2024-05-01T19:02:19
"Phỏng vấn Minh Hằng: ""Yêu nhau 8 năm tôi và chồng không có vấn đề gì, nhưng 8 tháng qua lại xảy ra nhiều chuyện""",2024-05-01T13:40:00
Minh Hằng sau gần 1 năm sinh con: Vóc dáng gợi cảm cuốn hút nhờ chăm chỉ làm điều này,2024-04-25T08:30:54
"Minh Hằng thẳng thừng từ chối chụp ảnh với người hâm mộ tại sự kiện, chuyện gì đây?",2024-04-24T12:29:54
"Minh Hằng đưa con trai đi tân trang dịp cuối tuần, nhóc tì 8 tháng tuổi có biểu cảm hài hước khiến netizen ""đổ rầm rầm""",2024-04-20T23:20:13
"2 mẹ bỉm hot Vbiz lần đầu đọ sắc: Nhã Phương visual khó chê, Minh Hằng thế nào hậu giảm cân?",2024-04-14T22:16:00
"Minh Hằng tuổi 37 da mịn như 18: Từng tiết lộ thức uống ""rẻ tiền"" thường dùng mỗi sáng, giúp da đàn hồi, trắng sáng",2024-04-10T10:15:00
Hài hước biểu cảm hoang mang của quý tử nhà Minh Hằng khi mẹ rủ rê làm điều này,2024-04-07T11:33:42
"Minh Hằng tổ chức sinh nhật cho chồng: Bí mật đặt căn penthouse view cực đỉnh, còn công khai cảnh ""khoá môi""",2024-04-05T00:01:00
"Quý tử nhà Minh Hằng lộ diện ngoại hình mũm mĩm, còn có hành động khiến mẹ ""tan chảy""",2024-03-30T20:43:46
"Cả Minh Hằng và Hà Tăng đều đầu tư món đồ này cho con, muốn con sở hữu IQ cao các mẹ nên làm theo",2024-03-27T11:56:00
"Minh Hằng thấm dần ""đoạn trường"" nuôi con nhỏ của mẹ bỉm sữa",2024-03-26T13:27:21
Loạt khoảnh khắc đáng yêu của con trai Minh Hằng,2024-03-18T14:07:00
"Quý tử nhà Minh Hằng lên sóng, nhận ""bão"" tim vì vẻ ngoài quá đáng yêu",2024-03-17T00:03:00
"Minh Hằng khoe ảnh hội ngộ ""em gái"" Diệu Nhi, đọ mặt mộc cực đỉnh khi chung khung hình",2024-03-14T11:29:00
"Sao Việt 6/3: Minh Hằng trẻ đẹp bên ông xã, Bảo Thanh đen nhẻm năm 16 tuổi",2024-03-06T08:02:00
"Phong cách trẻ trung, nổi bật của Minh Hằng ở tuổi 37",2024-03-02T21:30:20
"Đây là loại rau ""đắt cũng nên mua"" mà Hà Tăng lẫn Minh Hằng đều ""mê mệt"": Ăn sáng, ăn vặt lẫn xay sinh tố đều không thể thiếu",2024-03-01T08:05:00
"Minh Hằng đăng ký kết hôn sau khi sinh con, hiếm hoi chia sẻ về ông xã doanh nhân",2024-02-26T11:33:00
"Minh Hằng đã sẵn sàng cho cuộc chiến ăn dặm, chuẩn bị loạt đồ sang xịn mịn cho con trai",2024-02-23T23:00:30
"Minh Hằng hé lộ niềm vui hàng ngày của ""mẹ bỉm sữa"", nghe xong ai cũng đồng tình",2024-02-22T18:28:00
"Dàn mẹ bỉm Vbiz đua sắc đầu năm mới: Minh Hằng - Nhã Phương khoe visual thăng hạng, Đỗ Mỹ Linh gây sốt bên chồng Chủ tịch",2024-02-14T11:09:00
"Minh Hằng khoe bên trong bao lì xì của quý tử hào môn, con số không phải dạng vừa!",2024-02-12T10:01:00
"Minh Hằng xả kho ảnh gia đình đầu năm mới, nhóc tỳ hào môn chiếm mọi sự chú ý",2024-02-11T09:33:00
"Sao Vbiz xúng xính diện áo dài: Đặng Thu Thảo xứng danh ""thần tiên tỷ tỷ"", Minh Hằng cực ""keo lỳ""",2024-02-09T22:06:19
"Ngoài đào và mai, đây là loài hoa không thể ''vắng mặt'' trong biệt thự của Minh Hằng, Hà Tăng, Noo Phước Thịnh... dịp Tết",2024-02-09T08:20:06
"Dàn sao Vbiz rần rần đón Tết: Minh Hằng - Lệ Quyên tự tay gói bánh, Thùy Tiên dọn nhà nhưng biểu cảm gì đây!",2024-02-08T17:02:00
"Chồng doanh nhân Minh Hằng bồng bế quý tử, nhóc tỳ chiếm sóng vì vẻ ngoài đáng yêu",2024-02-03T14:36:00
"Hội bạn đình đám Vbiz họp mặt: Mai Phương Thúy khoe đôi chân 1m18, Minh Hằng gây sốt với visual mẹ bỉm",2024-02-03T11:05:00
"Công bố loạt khoảnh khắc từ khi chào đời của quý tử nhà Minh Hằng, diện mạo hiện tại gây ""lụi tim""",2024-01-30T11:00:00
"Minh Hằng khoe visual ""cân đẹp"" mọi góc độ tại WeChoice Awards 2023, body và góc nghiêng gây chú ý",2024-01-29T00:01:00
"Minh Hằng gây sốt với visual ""mười điểm"" tại WeChoice Awards 2023, vóc dáng mẹ bỉm qua camera thường càng gây chú ý",2024-01-28T14:00:00
"Mỹ nhân Việt khoe chồng ""đảm"": Ông xã Minh Hằng chăm con giỏi hơn vợ, shark Bình vào bếp một lần mà ""gây sốt"" mạng xã hội",2024-01-24T22:27:48
"Minh Hằng vào bếp, tiết lộ bí quyết món xốt cực bắt vị chấm món nào cũng hợp đến lạ",2024-01-23T15:30:00
"Cận cảnh gương mặt đáng yêu của con trai Minh Hằng, thế nào mà được nhận xét là ""bản sao của mẹ""",2024-01-15T08:30:00
“Mẹ bỉm” Minh Hằng tâm sự về lần đầu thay tã cho con,2024-01-09T08:00:00
"Minh Hằng khoe ảnh du lịch bên ông xã doanh nhân, vóc dáng mẹ bỉm hậu giảm cân gây bất ngờ",2024-01-03T12:25:00
"Minh Hằng cùng gia đình nhỏ đi du lịch, khoe khoảnh khắc hạnh phúc trước thềm năm mới",2023-12-31T13:15:00
"Sau 4 tháng sinh con, Minh Hằng hiếm hoi công khai rõ gương mặt nhóc tỳ",2023-12-26T00:04:00
"Sao Việt đón Giáng sinh: Minh Hằng dày công decor biệt thự tặng quý tử, Thiều Bảo Trâm dự định trưng cây thông Noel đến Tết",2023-12-23T09:00:00
