Title,Date
Chào đời vào ngày đặc biệt - các em bé mang tên khai sinh độc đáo: Con trai Cục trưởng Xuân Bắc cũng không ngoại lệ,2025-05-05T08:04:00
"Bộ phim khiến ai cũng phải cúi đầu cảm phục, tự hào trước sự hy sinh của những “bóng hồng bất tử”: Cục trưởng Xuân Bắc có vai “để đời”",2025-04-28T21:36:00
Cục trưởng Nguyễn Xuân Bắc nói gì về việc nghệ sĩ quảng cáo thổi phồng sự thật?,2025-04-16T14:36:00
Cục trưởng Cục Nghệ thuật biểu diễn Xuân Bắc dùng 5 từ để nói về bộ phim viral nhất hiện tại,2025-04-03T14:09:00
Cục trưởng Xuân Bắc: Nghệ sĩ khi quảng cáo phải đặt trách nhiệm lên hàng đầu,2025-03-26T09:32:00
"NSND Tự Long: ""Tôi không thể diễn được với ai ngoài Xuân Bắc""",2025-03-11T18:37:00
"NSND Xuân Bắc: ""Nghệ thuật truyền thống mang nhiều tính nguyên bản hơn trình diễn""",2025-03-07T16:08:00
Cục trưởng Xuân Bắc nói gì về Hòa Minzy mà gây bão mạng?,2025-03-04T11:15:00
"Cục trưởng Xuân Bắc nhắn tin cho vợ, chỉ 1 câu đã cho thấy thái độ, tình cảm ra sao",2025-02-26T21:45:00
Táo Quân 2025: Phát ngôn đầu tiên của sao nam đóng thay vai của Xuân Bắc - Công Lý,2025-01-29T17:01:00
"Sao nam hot nhất Táo Quân 2025: Gây sốt khắp MXH vì diễn quá đỉnh, càng xem càng nhớ Xuân Bắc - Công Lý",2025-01-29T04:15:00
"Cục trưởng Xuân Bắc: Tránh tổ chức liên hoan ồ ạt để săn huy chương, dẫn đến rẻ rúng danh hiệu",2025-01-12T09:31:00
"Diễn viên thay Xuân Bắc đóng Táo quân, từng áp lực đến mức không ăn nổi là ai?",2025-01-09T08:14:00
Cục trưởng Xuân Bắc đăng status dài gần 100 chữ về Giám đốc Nhà hát Chèo Quân đội,2025-01-02T08:36:00
Cục trưởng Cục Nghệ thuật biểu diễn Xuân Bắc nói về hiệu quả kinh tế hai show anh trai,2025-01-01T06:44:18
"NSND Xuân Bắc: 2 tháng làm Cục trưởng, tôi vẫn nhớ nghề diễn",2024-12-31T22:00:00
"Tổng Bí thư Tô Lâm gặp gỡ nhiều văn nghệ sĩ: NSND Xuân Bắc, NSƯT Quyền Linh, Lý Hải, HIEUTHUHAI...",2024-12-30T23:03:00
Cục trưởng Cục Nghệ thuật Biểu diễn - NSND Xuân Bắc đóng Táo Quân 2025,2024-12-30T11:03:00
"Chỉ một bức ảnh ""mờ ám"" với Tự Long, Xuân Bắc đã khiến cõi mạng rần rần vì điều này",2024-12-28T22:10:00
"NSND Xuân Bắc, NSND Công Lý không đóng Táo Quân 2025",2024-12-27T12:30:00
Xót xa hình ảnh cụ ông bị bỏng trong vụ cháy tại khu tập thể Thanh Xuân Bắc đêm qua,2024-12-19T16:50:00
"Camera bắt được cảnh NS Tự Long nói 1 câu gây choáng với NS Xuân Bắc, dân mạng không tin nổi vào tai mình",2024-12-14T14:24:00
"NSND Tự Long: ""Cục trưởng Xuân Bắc tới xem nghệ sĩ nhà nước và tự do gắn kết nhau thế nào""",2024-12-14T14:04:00
"NSND Xuân Bắc muốn tham gia show Chông Gai, khẳng định “chưa bao giờ có chương trình ảnh hưởng xã hội tốt và tích cực thế này”",2024-12-13T22:30:00
"Nghệ sĩ Xuân Bắc xuất hiện ở sân khấu Anh Trai Say Hi, 30 anh trai duyệt chương trình đến 4h sáng",2024-12-07T10:55:00
Cục trưởng Xuân Bắc gặp sự cố trước giờ diễn,2024-11-20T13:36:00
"Là Cục trưởng nhưng NSND Xuân Bắc vẫn kính nể, cúi đầu trước một người",2024-11-14T22:33:00
Bất ngờ trước diện mạo của Bi Béo - con trai NSND Xuân Bắc,2024-11-09T20:00:00
"NSND Xuân Bắc thẳng thắn giải đáp câu hỏi ""lên làm Cục trưởng có còn diễn hài không?""",2024-11-07T18:07:00
NSƯT Kiều Minh Hiếu thay thế vị trí giám đốc của NSND Xuân Bắc,2024-11-07T17:46:00
"Động thái của NSND Xuân Bắc sau khi lên chức Cục trưởng, nhiều nghệ sĩ vào động viên",2024-11-07T08:35:00
"Những bữa ""cơm nguội"" bình dị lúc nửa đêm của NSND Xuân Bắc",2024-11-02T13:33:00
Xuân Bắc: Hành trình từ diễn viên trở thành Cục trưởng Cục Nghệ thuật biểu diễn,2024-10-31T17:32:00
Ai thay thế vị trí giám đốc của NSND Xuân Bắc ở Nhà hát Kịch Việt Nam?,2024-10-31T11:20:00
"Nhiều sao Việt bày tỏ niềm vui, chúc mừng NSND Xuân Bắc làm Cục trưởng Cục Nghệ thuật biểu diễn",2024-10-30T22:22:00
NSND Xuân Bắc được bổ nhiệm làm Cục trưởng Cục Nghệ thuật biểu diễn,2024-10-30T17:10:00
"Xuân Hinh nói về Xuân Bắc, Tự Long: ""Không biết bọn trẻ nó chiều mình hay mình đi hầu chúng đây""",2024-10-27T21:32:00
"NSND Xuân Bắc nói về ""đại gia ngầm đất Bắc"": Diễn tốt là anh cho thêm 50 nghìn đồng",2024-10-03T10:42:00
"NSND Xuân Bắc mê cách Tuấn Hưng - Duy Mạnh kết đoàn, khán giả “dụ” làm show với 1 Anh Tài ""đỉnh nóc kịch trần""",2024-09-23T21:19:00
"Được bạn bè khen ""khéo dạy con"" khi có hành động ý nghĩa sau cơn bão, Xuân Bắc trả lời 2 câu nhận đồng tình",2024-09-13T09:42:00
NSND Xuân Bắc cùng 2 con trai hỗ trợ dọn cây đổ trên phố sau bão Yagi,2024-09-09T00:03:00
"Xuân Bắc cùng 2 con trai đi dọn dẹp khu phố sau bão Yagi, Bi Béo ""chốt"" 1 câu đúng chất ""meme""",2024-09-08T20:16:00
Nghệ sĩ Xuân Bắc bị kẻ xấu mạo danh để lừa đảo,2024-08-26T11:46:00
NSND Xuân Bắc tiễn đưa nghệ sĩ Hữu Độ,2024-08-16T18:33:00
"NSND Tự Long, Xuân Bắc và dàn nghệ sĩ tiễn đưa NSƯT Bùi Phương Nga",2024-07-19T17:07:00
"Tự Long thi ""Anh trai vượt ngàn chông gai"", Xuân Bắc nhắn: Đừng để tôi nóng mắt",2024-07-02T19:35:57
"Xuân Bắc xưng hô ""tao"" với Tự Long còn nói thẳng điều này",2024-07-01T22:35:07
"Bi Béo thi vào lớp 10, vợ Xuân Bắc có động thái được khen dạy con khéo: Đây là điều cha mẹ PHẢI làm khi con thi không tốt",2024-06-10T06:16:00
"Con trai Xuân Bắc lớn phổng phao, liên tục ""tấu hề"" khi đi thi tuyển vào lớp 10",2024-06-09T16:03:24
"Xuân Bắc cho 2 ""quý tử"" theo học tại 1 trường song ngữ có học phí bất ngờ, khuôn viên rộng tới 30.000m2 lại xanh - sạch - đẹp nhất nhì miền Bắc",2024-04-30T16:40:00
"Quên hình ảnh hài hước đi, Bi béo nhà Xuân Bắc giờ cực chững chạc, tự tin hùng biện ở trường học như này đây!",2024-04-28T07:02:00
Sẽ có một Táo Quân tham gia Đạp gió phiên bản nam: Tự Long hay Xuân Bắc?,2024-04-12T22:02:07
"Chàng trai Tây có cái tên đặc biệt lên show bị MC Xuân Bắc ""trôn Việt Nam"", phản xạ nhanh và làm thơ rất ngọt",2024-03-21T08:41:00
"Xem lại hài Tết Táo Quân hay nhất: Xuân Bắc vẫn đỉnh, Quang Thắng phá đảo với bản rap về kinh tế",2024-02-08T22:10:00
"""Nam Tào"" Xuân Bắc ôm chặt ""cô Đẩu"" Công Lý trong ngày cận Tết",2024-02-07T16:52:00
"""Nam Tào"" thay thế Xuân Bắc có con gái mới 7 tuổi đã gây sốt: Tiết lộ 1 câu biết ngay dạy con quá khéo",2024-02-05T16:12:00
"Xuân Bắc nói lý do không đi xem ghi hình Táo Quân, Chí Trung có động thái này với dàn diễn viên mới",2024-02-02T00:02:02
"Vì sao Xuân Bắc, Chí Trung rời Táo Quân 2024?",2024-02-01T23:05:30
Người thay Xuân Bắc đóng Nam Tào trong Táo Quân 2024 là ai?,2024-01-30T10:16:00
"Táo Quân sẽ ra sao khi không có Xuân Bắc, Tự Long, Chí Trung?",2024-01-29T21:05:00
NSƯT Xuân Bắc khoe hậu trường tập Táo quân,2023-12-29T17:24:29
"Nghệ sĩ Xuân Bắc xuất hiện trên thảm đỏ: ""Được mời tham dự Gala Human Act Prize 2023 tôi thích lắm""",2023-12-12T18:21:00
"Gala Human Act Prize 2023: Nghệ sĩ Xuân Bắc chia sẻ xúc động, Giám đốc điều hành quỹ VinFuture và CMO One Mount cũng góp mặt",2023-12-12T10:27:00
"Kiểm tra bài tập của Bi Béo, Xuân Bắc làm 1 điều không phải ai làm được, netizen khen ""quá tâm lý""",2023-09-11T17:21:25
"Đưa con trai đi khai giảng, dân tình soi ra độ chịu chi của Xuân Bắc khi mỗi năm tốn cả gia tài cho việc này",2023-09-06T21:29:00
"Nhóc tỳ nhà sao Việt nô nức đi khai giảng: Xoài chuẩn soái ca, con Xuân Bắc không còn ""chán đời"", lột xác bất ngờ!",2023-09-05T17:20:00
"Bên trong biệt phủ tiền tỷ của Xuân Bắc: Không gian sống an yên, chiếm ""spotlight"" là sân vườn quanh năm hoa trái mọc sai trĩu",2023-08-29T16:19:00
"Ngỡ ngàng trước diện mạo hiện tại của quý tử nhà Xuân Bắc: Đã giảm cân, dậy thì quá thành công",2023-08-23T20:06:00
"Bị bố bắt gặp ngủ gật khi đang học bài, Bi Béo nhà Xuân Bắc chối bằng lý do ai nghe xong cũng cười",2023-08-17T19:15:00
"Xu hướng làm nhà theo phong cách ""resort tại gia"" gọi tên Xuân Bắc, Mạnh Trường, ca nương Kiều Anh",2023-08-13T20:00:00
"Sao Việt 27/7: Hồ Quỳnh Hương lộ diện lạ lẫm, Xuân Bắc khoe anh trai ""giống như đúc""",2023-07-27T08:06:54
"Xuân Bắc lớn tiếng ""mắng"" Tự Long vì nghịch ngợm",2023-05-24T00:02:00
"Hai con trai Xuân Bắc hát tiếng Anh, dân mạng xuýt xoa: ""Đúng con nhà nòi""",2023-05-23T18:31:00
"Cậu út mè nheo rồi khóc ăn vạ, Xuân Bắc chỉ nói vài câu mà có thể ""trị đẹp""",2023-05-14T11:53:00
"Vừa lên cấp 3, cậu cả nhà Xuân Bắc đã mê ""làm đỏm"", thậm chí còn công khai cả bạn gái: Phụ huynh biết nhưng chỉ đáp lại đúng một câu!",2023-04-10T00:02:00
"Đi công tác về thì phát hiện con trai cưng làm chết bể cá Koi đắt tiền, Xuân Bắc có phản ứng bất ngờ",2023-03-20T00:02:00
"Sao Việt 19/2: Xuân Bắc tươi tắn hậu ồn ào, Hoa hậu Thu Hoài nóng bỏng ở tuổi 47",2023-02-19T07:47:00
"NSƯT Xuân Bắc tái xuất mạng xã hội sau ồn ào ""Cái tát của mẹ""",2023-02-04T10:01:00
"Diện mạo mới thay đổi chóng mặt của Bi Béo khiến bà xã Xuân Bắc phải thốt lên ""không nhận ra"": Bi đã khác ngày xưa lắm rồi!",2023-01-31T19:13:00
"Xuân Bắc và những lần vướng rắc rối, tranh cãi trên mạng xã hội",2023-01-31T07:59:00
"Khi 2 danh hài Vbiz vướng tranh cãi: Xuân Bắc phải xin lỗi, Trấn Thành bị một phen lao đao",2023-01-28T16:49:57
"Nghệ sĩ Xuân Bắc xin lỗi khán giả về bài viết ""Cái tát của mẹ""",2023-01-27T19:54:00
"Bộ VH,TT&DL: ""Nếu Xuân Bắc có vi phạm thì sẽ xử lý""",2023-01-27T15:38:00
Dàn Táo Quân đang làm gì giữa lúc Xuân Bắc gặp lùm xùm?,2023-01-27T12:44:46
Cục Nghệ thuật Biểu diễn nói gì sau phát ngôn ẩn ý của Xuân Bắc với khán giả?,2023-01-26T21:34:00
"Xuân Bắc, anh sai rồi!",2023-01-26T13:30:00
"NSƯT Xuân Bắc vẫn giữ một thái độ dù gây tranh cãi về phát ngôn mắng khán giả chê ""Táo Quân""",2023-01-25T21:02:16
NÓI THẲNG: Cái tát của mẹ - Xuân Bắc là mẹ công chúng?,2023-01-25T17:54:14
"Xuân Bắc ẩn ý mắng khán giả ""Ăn cháo đá bát"": Phát ngôn kiêu ngạo, dễ gây phản cảm và cần xin lỗi",2023-01-25T17:50:00
"Xuân Bắc kể chuyện ""con chê bánh chưng bị tát"", cộng đồng mạng phản ứng gay gắt",2023-01-25T14:40:19
"NSƯT Xuân Bắc khiến dư luận dậy sóng đầu năm với status có câu ""Mày là đồ ăn cháo đá bát""",2023-01-25T14:37:02
"""Chê bánh chưng bị ăn tát"", nghệ sĩ Xuân Bắc đang ám chỉ gì?",2023-01-25T13:11:31
Xuân Bắc mắng người chê Táo quân: Cú tát vào mặt khán giả!,2023-01-25T11:21:57
NSƯT Xuân Bắc nói gì khi bị yêu cầu xin lỗi sau bài đăng bóng gió mắng khán giả chê Táo Quân?,2023-01-25T10:28:00
"Xuân Bắc ""mắng"" người chê Táo quân là ""ăn cháo đá bát""?",2023-01-24T20:40:09
"Phản ứng của Xuân Bắc khi có khán giả nhắn tin: ""Táo Quân năm nay chán!""",2023-01-22T19:46:00
"NSƯT Xuân Bắc: ""Tôi không nghĩ Táo Quân kéo dài 20 năm, được yêu thích đến thế, dù đôi lúc tôi bị chê mở tivi thấy mặt ông này là muốn tắt""",2023-01-22T11:00:00
"Xuân Bắc nửa đêm vẫn đến nhà Công Lý, lý do khiến fan cảm động",2023-01-20T12:30:00
"Người tạo hình cho Công Lý, Xuân Bắc trong Táo Quân hơn chục năm qua là ai?",2023-01-13T08:22:25
"Bà xã kể chuyện của NS Công Lý tại hậu trường Táo Quân, xúc động 1 câu nói của NS Xuân Bắc",2023-01-10T16:09:00
"Sao Việt 30/12: Các nghệ sỹ Công Lý, Xuân Bắc, Quốc Khánh tập Táo Quân 2023",2022-12-30T11:07:00
Xuân Bắc và Nhà hát Kịch Việt Nam đón nhận Huân chương Lao động hạng ba,2022-12-15T12:20:00
"Lâu lắm mới xuất hiện nhưng Bi Béo nhà Xuân Bắc lại gây bất ngờ với vẻ ngoài khác lạ, đến mẹ ruột cũng ngạc nhiên!",2022-11-14T23:45:00
"Hai ""quý tử"" nhà Xuân Bắc trưởng thành sau Táo Quân: Bi Béo cao lớn, cậu cả như bố thời trẻ",2022-11-09T22:31:06
"NSƯT Xuân Bắc cùng giới trẻ Hà thành ""đột nhập"" Xứ Sở Lạ Lùng",2022-10-24T17:30:00
"Sao Việt 28/9: Tự Long ""bóc phốt"" bạn thân Xuân Bắc",2022-09-28T07:38:00
NSND Tự Long: Tôi với Xuân Bắc trên 20 năm nay vẫn nhịn nhau để cùng diễn cùng làm nghề,2022-08-14T13:56:00
"Con trai Xuân Bắc kể chuyện học môn Lịch sử: Đang vui thì cậu nhóc ""quay xe"" nói 1 câu khiến bố ""toát mồ hôi hột""",2022-08-05T22:17:00
"Gần 30 năm tình bạn tri kỷ của Xuân Bắc - Tự Long, kết hợp ăn ý trên mọi mặt trận",2022-08-03T20:40:00
"Công bố 139 hồ sơ xét nghệ sĩ nhân dân, nhiều tên quen thuộc như Xuân Bắc, Chí Trung, Quốc Khánh",2022-07-26T16:29:00
Nghệ sĩ Công Lý rạng rỡ khi hội ngộ Xuân Bắc - Quang Thắng,2022-06-22T09:10:00
"NSƯT Xuân Bắc: “Sinh Con, Sinh Cha” là chương trình có chiều sâu, đi vào lòng người, đi vào nhận thức",2022-06-07T13:30:00
Ơn Giời Cậu Đây Rồi: Trường Giang nói lý do Xuân Bắc không làm MC,2022-06-04T14:25:00
"Xuân Bắc ""cưa sừng làm nghé"", bà xã ""chốt"" liền 1 câu khiến dân mạng cười ""thả ga""",2022-06-02T13:23:00
Thái độ của Cát Phượng khi bị Xuân Bắc nhắc đến chuyện tình cảm hậu chia tay Kiều Minh Tuấn,2022-05-23T15:05:00
"NSƯT Xuân Bắc: ""Tôi chưa bao giờ mắng con vì điểm số""",2022-05-18T08:44:00
"Thay Xuân Bắc làm MC Ơn Giời Cậu Đây Rồi, Trường Giang có động thái bất ngờ liên quan đến Running Man",2022-05-13T11:29:00
"Chỉ 1 bình luận với người hâm mộ, Xuân Bắc lộ cách dạy con khiến nhiều người phải nể phục: Nghiêm khắc nhưng rất tinh tế",2022-05-11T20:31:00
Danh tính MC thay thế NSƯT Xuân Bắc dẫn Ơn Giời Cậu Đây Rồi mùa 8,2022-05-10T14:31:00
Xuân Bắc: Làm cha mẹ mà áp đặt tiêu cực cho con thì tôi chỉ mong có bàn tay vô hình vả vào mặt cho sưng vù,2022-03-19T16:02:00
"Không gian sống an yên của nghệ sĩ Việt: Từ biệt phủ như resort của Xuân Bắc tới biệt thự nhà vườn 10.000m2 của diva Mỹ Linh, tất cả đều ""sặc mùi tiền""",2022-03-15T21:15:00
"Từ vụ con trai Xuân Bắc, bố mẹ có nên xem trộm điện thoại của con? - 3 em nhỏ lên tiếng",2022-03-15T20:48:00
"Nơi mọi bão giông đều dừng chân sau cánh cửa của Xuân Bắc: Rộng cả ngàn mét vuông, 4 mặt đều là gỗ, tách biệt chốn xô bồ phố thị",2022-03-15T12:08:00
"Bà xã NSƯT Xuân Bắc lên tiếng: ""Tôi cảnh báo chứ không lên án ai""",2022-03-14T21:05:00
"Sau sự việc vợ Xuân Bắc kiểm tra điện thoại của con, hãy tìm hiểu và sử dụng ngay Messenger nhí!",2022-03-14T19:30:42
"Tranh cãi vợ Xuân Bắc phạt con: ""Khi nói chuyện với con, phụ huynh còn phải uốn lưỡi nhiều hơn với sếp và bố mẹ đẻ""",2022-03-14T17:37:00
"Tiến sĩ tâm lý nói về việc vợ Xuân Bắc phạt con gay gắt: Người mẹ thiếu bình tĩnh, làm mọi người nhìn các con như ""kẻ phạm tội""!",2022-03-14T13:58:00
Lộ tin nhắn vợ Xuân Bắc tiết lộ tình trạng con trai sau thông tin gây tranh cãi?,2022-03-14T12:25:00
5 tuyệt chiêu dạy con của Xuân Bắc,2022-03-14T09:14:00
"Netizen đồng loạt phản đối chuyện vợ Xuân Bắc ném điện thoại, công khai toàn bộ nội dung nhạy cảm trong Facebook của con",2022-03-13T23:16:00
"Xuân Bắc nhiễm Covid-19, Tự Long làm ngay 1 việc gây bão mạng",2022-03-05T08:45:00
Netizen nhanh trí nghĩ ra cách để Xuân Bắc - Công Lý có thể trở lại ở Táo Quân 2023!,2022-02-01T18:04:00
Xuân Bắc & Công Lý đang làm gì khi Táo Quân 2022 lên sóng?,2022-01-31T22:40:00
"Không quay Táo Quân 2022, Xuân Bắc bất ngờ tự làm luôn show Táo của chính mình!",2022-01-31T08:52:00
"Không phải Quốc Khánh, đây mới là Ngọc Hoàng đầu tiên ở Táo Quân: Diễn hài át cả Xuân Bắc - Công Lý, hôn nhân viên mãn bên vợ trẻ kém 13 tuổi",2022-01-30T08:01:00
"Ảnh hot: Công Lý ""đánh lẻ"" cùng Xuân Bắc hậu rời Táo Quân 2022, tình trạng sức khỏe hiện tại ra sao?",2022-01-28T10:34:00
"Cậu bé dùng mũi để đọc từng nét chữ viết tay của Xuân Bắc, ""lão đại"" Wowy chứng kiến mà tim đập chân run",2022-01-15T09:01:00
"Vào team Xuân Bắc, làm 6 bước ""về tay"" 500K, ""tẹt ga"" chơi Tết",2022-01-13T08:00:00
Nóng: Xuân Bắc & Công Lý từ giã vai Nam Tào - Bắc Đẩu ở Táo Quân 2022?,2022-01-07T22:53:13
"Chàng trai 25 tuổi khiến Xuân Bắc, Ngô Kiến Huy ""nín thở"" khi bịt mắt giải rubik dưới nước",2021-12-18T13:33:00
