Title,Date
Cái khó của Đông Nhi,2025-04-23T15:16:00
Gần 6 triệu người hồi hộp xem Diệu Nhi giải cứu Đông Nhi suýt rơi áo trên sân khấu,2025-04-20T23:59:00
"Cả showbiz ùa lên sân khấu ủng hộ Đông Nhi, riêng “em gái ruột” Diệu Nhi làm 1 hành động cứu nguy gây chú ý",2025-04-20T14:22:00
Hồ Hoài Anh trở lại cùng Đông Nhi,2025-04-17T12:31:00
Đông Nhi lần đầu tiên kết hợp cùng Rhymastic: Khi bố mẹ ra nhạc vì các con yêu,2025-03-13T13:30:00
"Hội bạn xinh - giỏi - quyền lực nhất Vbiz: Đông Nhi - Minh Hằng khoe sắc ""đỉnh chóp"", Hoàng Thuỳ Linh gây ấn tượng vì phong cách đặc biệt",2025-03-01T07:29:00
"CĂNG: 2 sao nam đấu tố chuyện đời tư bê bối, nói dối, lợi dụng Đông Nhi, người trong cuộc nói gì?",2025-02-27T10:14:00
"Con gái Đông Nhi nói tiếng Anh như người nước ngoài ở tuổi lên 4, netizen trố mắt ngạc nhiên nhưng lo ngại điều này",2025-02-13T07:26:00
"Video: Vợ Vũ Cát Tường nhảy tặng chú rể quá xuất sắc, Đông Nhi - Diệu Nhi rưng rưng xúc động",2025-02-12T23:07:00
"Dàn sao Việt đổ bộ lễ thành đôi Vũ Cát Tường: SOOBIN lộ diện cực bảnh, Thiều Bảo Trâm sexy - vợ chồng Đông Nhi chiếm spotlight",2025-02-12T17:34:00
"Đông Nhi “phá vỡ” hình ảnh mẹ bỉm, khuấy đảo chung kết Chị Đẹp Đạp Gió",2025-01-26T15:06:00
"Đông Nhi tái xuất bùng nổ tại chung kết Chị đẹp đạp gió, fan gọi tên cho mùa 3",2025-01-26T09:50:00
"Đông Nhi khoe vòng eo phẳng lì sau 4 tháng sinh em bé, tlinh - Pháp Kiều có màn kết hợp “chấn động” tối nay!",2024-12-31T16:11:00
"Nam tân binh khóc nức nở, ""gà cũ"" Đông Nhi khoe diện mạo cực bén sau khi đầu quân về ""nhà mới""",2024-11-15T15:30:00
"""Gà cũ"" Đông Nhi chật vật trở lại Vpop, thổ lộ từng có ý định xin làm backup dancer cho Trúc Nhân vì quá nhớ sân khấu",2024-10-31T21:41:00
"Ngày 20/10 trò chuyện cùng Đông Nhi: Trở thành một người vợ, người mẹ để chăm sóc cho gia đình là mơ ước của Nhi",2024-10-20T17:30:00
"Đông Nhi bị phát hiện ""ngó lơ"" Diệu Nhi trong sinh nhật hậu nghi vấn ""nghỉ chơi""?",2024-10-20T09:19:00
"Ở cữ sướng như Đông Nhi, sáng nào cũng có người chăm tận nhà, bảo sao rạng rỡ, xinh đẹp",2024-09-21T23:00:00
"Con gái 2 tuần tuổi của Đông Nhi làm nhiều biểu cảm tinh nghịch, netizen đồng loạt nhận xét điều này",2024-09-10T00:07:00
Cô gái Hàn Quốc Han Sara rời bỏ Đông Nhi,2024-08-28T13:27:00
"Hoàng Thuỳ Linh có động thái đầu tiên hậu sinh con, khiến Đông Nhi phải thốt lên 1 câu",2024-08-26T19:34:00
"Đông Nhi khóc nức nở, hé lộ chi tiết đặc biệt trong ngày sinh con gái thứ 2",2024-08-24T13:04:00
"Lần sinh thứ 2, Đông Nhi chọn nơi thuộc top đầu trong các bệnh viện VIP tại TP HCM",2024-08-22T23:30:00
"Hé lộ ảnh cận mặt con gái thứ 2 của Đông Nhi, mẹ bỉm vừa sinh xong đã làm 1 việc khiến hội bạn ngỡ ngàng",2024-08-22T15:18:00
"HOT: Đông Nhi đã sinh con gái thứ 2, hé lộ thông tin đặc biệt",2024-08-22T09:40:00
"Đông Nhi và Ông Cao Thắng ""khoe"" cuộc sống tại khu căn hộ Marriott lớn nhất thế giới",2024-08-10T15:30:00
"Đông Nhi xinh đẹp gợi cảm tung bộ hình nét căng bụng bầu tháng thứ 7, vẻ nhắng nhít của bé Winnie gây sốt",2024-06-22T17:02:25
"Đông Nhi lộ diện tươi rói bên ông xã, khoe bụng bầu vượt mặt ở tháng thứ 6",2024-05-19T13:26:00
"Đông Nhi khoe bụng bầu to vượt mặt, nhan sắc ở tháng thứ 5 thai kỳ gây chú ý",2024-04-27T12:00:35
"Nữ ca sĩ người Hàn từng khiến Đông Nhi - Noo Phước Thịnh tranh giành: Cát-xê bèo bọt, ""mất hút"" sau khi rời công ty",2024-04-18T11:50:00
"Đông Nhi khoe bụng bầu ở tháng thứ 4, gần 2 thập kỷ bên nhau vẫn ""phát cẩu lương"" bên Ông Cao Thắng",2024-04-07T11:02:32
"Đông Nhi mang bầu 4 tháng vẫn diễn cực sung, có hành động tinh tế để bảo vệ em bé",2024-04-02T19:00:00
"Bị mẹ Đông Nhi phạt, Winnie có biểu cảm như này, fan khen nức nở: ""Ngoan ngoãn lại đáng yêu chẳng ai nỡ giận""",2024-03-30T16:38:00
Món ăn khiến con Phạm Quỳnh Anh và Đông Nhi mê tít,2024-03-23T13:30:00
"Chị Đẹp Đạp Gió thông báo mùa 2: Đông Nhi - Bích Phương bị réo tên, 1 cái tên được dự đoán ""hot hòn họt""",2024-02-26T22:55:00
"Đông Nhi ""xả"" ảnh du lịch cùng chồng con, khoe cận visual đẹp ngỡ ngàng khi mang thai lần 2",2024-02-26T00:04:26
"Đông Nhi tự hào khi con gái ra dáng chị cả, làm hành động ngọt ngào cho nhóc tỳ thứ 2",2024-02-24T13:30:00
"Cùng mẹ đi khám thai, con gái Đông Nhi được khen ngợi vì hành động này",2024-02-21T21:32:20
Clip Đông Nhi thông báo tin vui đến ông xã: Phản ứng Ông Cao Thắng khiến Phạm Quỳnh Anh và nhiều người xúc động,2024-02-16T00:01:00
"Đông Nhi trước khi xác nhận mang thai lần 2: Từng bị soi hint mẹ bầu, dùng loạt chiêu thức quen thuộc giấu dáng",2024-02-15T17:33:00
"Ông Cao Thắng hồi hộp toát mồ hôi, ngỡ ngàng khi Đông Nhi dùng cách đặc biệt để báo tin bầu lần 2",2024-02-15T12:33:00
"Đông Nhi đi diễn đầu năm trước khi công bố mang bầu lần 2: Nhảy nhót nhẹ nhàng, diện trang phục thoải mái, vẫn tự tin khoe eo!",2024-02-14T18:00:16
"Đông Nhi xác nhận mang thai lần 2, tiết lộ thái độ của nhóc tỳ đầu lòng",2024-02-14T16:48:00
Đông Nhi có động thái đặc biệt trước tin mang bầu lần thứ 2,2024-01-06T00:00:00
"Đông Nhi bắt tay Hiền Thục, Jun Phạm giải mã “Tết ổn” trong MV mới",2024-01-02T20:30:00
"Diệu Nhi - Đông Nhi chung khung hình sau tin rạn nứt tình cảm, mối quan hệ hiện ra sao?",2023-12-23T14:04:00
"Diễm My 9x và chú rể ""khoá môi"" trên sân khấu, Đông Nhi - Diệu Nhi và dàn sao bật khóc xúc động",2023-12-22T09:21:00
"Bé Winnie nhà Đông Nhi trổ tài nghe - nói - hiểu tiếng Anh cực tốt, cách nói chuyện với người lớn được khen ngợi",2023-12-21T10:01:00
"Đăng clip tự lái xe, Đông Nhi bị soi chi tiết đang mang thai lần 2?",2023-12-19T07:08:00
"Chỉ 1 bức ảnh hiếm hoi xuất hiện chung, Đông Nhi để lộ mối quan hệ với bố mẹ chồng hào môn",2023-11-15T10:09:00
"Đông Nhi xuất hiện tươi tắn bên Phạm Quỳnh Anh, để lộ 1 chi tiết khác lạ giữa nghi vấn mang thai con thứ 2",2023-11-01T14:31:00
"Đông Nhi bị cả MXH réo tên và đổ lỗi là ""nguyên nhân của nhiều bi kịch"", chuyện gì đây?",2023-11-01T11:00:00
"NS Đỗ Hiếu bất ngờ khen Đông Nhi ''sống đẹp"" hậu yêu cầu Noo Phước Thịnh dừng diễn loạt hit",2023-10-30T08:30:00
"Đông Nhi tổ chức sinh nhật hoành tráng cho ái nữ, ai dè để lộ 1 chi tiết đặc biệt giữa nghi vấn bầu lần 2?",2023-10-28T20:05:00
"Sơn Tùng và Đông Nhi cùng đi diễn Vietnam Idol: Người kéo theo dàn vệ sĩ, người thân thiện hỏi thăm ekip",2023-10-22T21:06:00
"Mỹ Tâm - Sơn Tùng - Đông Nhi đồng loạt khiến Quán quân Vietnam Idol 2023 ""tàng hình""",2023-10-22T18:05:00
"Mỹ Tâm thích thú xem Tăng Duy Tân diễn tại Vietnam Idol, nhưng lại vắng mặt khi Đông Nhi - Sơn Tùng ra diễn?",2023-10-22T15:15:00
"Diện váy giấu dáng nhưng vẫn bị soi vòng 2 lùm lùm, Đông Nhi nói gì trước tin đang mang thai?",2023-10-22T08:42:00
"Vợ chồng Đông Nhi dự đám cưới em gái, nhan sắc cô dâu là tiểu thư tập đoàn gây sốt",2023-10-07T22:15:00
"Lục Huy chia sẻ về việc không nhắc Đông Nhi trong bài viết thông báo rời UNI5, chuẩn bị đổi nghệ danh?",2023-10-04T17:24:00
Đông Nhi nói về scandal của bản thân,2023-09-08T16:10:00
"Bạch Khổng Tước là Hồ Quỳnh Hương hay Đông Nhi mà 4 cố vấn đều ""chốt đơn"" trong 1 nốt nhạc?",2023-08-26T11:37:00
"Ra MV cùng lúc, hiện tượng mạng đạt lượt view gấp 5 lần Đông Nhi, chiếm luôn top #1 thịnh hành!",2023-08-26T10:00:02
"Đông Nhi nỗ lực rời xa Đỗ Hiếu, DTAP loay hoay “thoát bóng” Hoàng Thùy Linh?",2023-08-25T23:59:00
"Không chỉ Đông Nhi, từng có 3 sao Việt đứng chung khung hình với BLACKPINK",2023-08-24T20:00:00
"Đông Nhi có phản ứng ""lạ"" khi thấy tên Bảo Thy hiện lên màn hình, 1 thành viên Uni5 vắng mặt tại họp báo",2023-08-23T10:49:00
Đông Nhi và Thiều Bảo Trâm khác lạ trong thông báo ra mắt sản phẩm mới,2023-08-16T14:47:00
"Đông Nhi, Hà Tăng, Tú Anh và các bà mẹ nổi tiếng đưa con vi vu du lịch nước ngoài trước thềm năm học mới",2023-08-09T18:32:00
"Công ty Đông Nhi - Ông Cao Thắng thông báo hoãn ra MV của 2 thành viên Uni5, bị chỉ trích bỏ bê ""gà nhà""",2023-08-04T11:30:00
"Mãn nhãn với Chung kết Miss World Vietnam 2023: Lona khuấy động với bản hit đình đám, Đông Nhi đem tới ca khúc đầy cảm xúc",2023-07-26T19:30:00
"HH Huỳnh Trần Ý Nhi “gây lú” vì giống Đông Nhi, 1 người đẹp cũng bất ngờ được gọi tên",2023-07-23T19:30:00
"Hé lộ dàn ca sĩ đêm Chung kết Miss World Vietnam 2023: Đông Nhi góp mặt, 1 nữ thần tượng đời đầu tái xuất",2023-07-22T13:30:00
"Con gái 3 tuổi của Đông Nhi có sở thích đặc biệt, bộc lộ năng khiếu ""con nhà nòi""",2023-06-07T14:09:00
MV mới của Đông Nhi bất ngờ biến mất khỏi YouTube,2023-05-19T09:22:00
"Cặp bạn thân 2 thập kỷ Đông Nhi - Khổng Tú Quỳnh: Người viên mãn đáng ngưỡng mộ, người tình cảm truân chuyên",2023-05-15T00:03:00
Đông Nhi khoe ảnh lúc 16 tuổi bên người bạn thân thiết,2023-05-14T12:16:00
"Vợ chồng Đông Nhi ""tình bể bình"", con gái cưng có biểu cảm gây bão nhận về 70.000 tương tác",2023-05-07T11:16:00
"Đông Nhi và Người Ôm Pháo Hoa: Bước đi khơi gợi thanh xuân lấy lòng fan sau scandal, dọn đường cho loạt dự án khủng trong năm 2023?",2023-04-27T00:00:00
Đông Nhi nói gì khi bị tố đạo nhái?,2023-04-24T16:09:00
Đông Nhi vùng vẫy,2023-04-24T08:08:00
Đông Nhi kết hợp DTAP trong MV mới nhưng hoá ra chỉ như bản mashup loạt hit hơn 10 năm?,2023-04-22T10:15:00
"Đông Nhi ra MV mới, Diệu Nhi liền có động thái đập tan nghi vấn bất hòa với ""chị guột""!",2023-04-22T09:22:00
Đông Nhi bắt tay với DTAP,2023-04-19T10:26:00
"Soi mi-li-met visual sao qua ""cam thường"": Hiền Thục gây khó tin ở tuổi 42, Đông Nhi và dàn mỹ nhân lộ nhan sắc thật còn Mai Tài Phến thế nào?",2023-04-07T10:10:00
"Đông Nhi - Hoàng Thùy Linh đọ sắc cực gắt, Trương Quỳnh Anh khoe vóc dáng gợi cảm trên thảm đỏ",2023-04-06T20:45:00
"Chỉ qua 1 hành động của em bé Winnie, vợ chồng Đông Nhi - Ông Cao Thắng ""ẵm"" trọn điểm 10 vì cách dạy con khéo léo",2023-03-31T20:16:00
"Đông Nhi cover bản hit từng được Hoàng Thùy Linh thể hiện nhưng lại khiến 1 hot girl đời đầu phải lên tiếng, lý do vì sao?",2023-03-17T18:15:00
"Đông Nhi thử thách con gái bằng 1 cái kẹo, phản ứng của bé ra sao mà đạt 1,5 triệu người xem?",2023-03-07T16:29:00
"Đông Nhi cover bản hit tự sáng tác cách đây hơn 10 năm, Hoàng Thùy Linh bất ngờ bị réo tên?",2023-03-01T16:00:00
"Đông Nhi bị ""lép vế"" so với Hà Nhi khi cover chung 1 bản hit?",2023-02-28T09:10:00
Con gái Đông Nhi đáng yêu trong khung ảnh cùng ca sĩ nhí từng khiến Taeyeon (SNSD) phát sốt,2023-02-26T11:47:26
"Ông Cao Thắng rủ rê Đông Nhi chụp hình: Tưởng ngôn tình hóa ra lại... cực ""độc - lạ""",2023-02-23T12:00:00
"Mai Phương Thuý, Đông Nhi đọ sắc trong khung ảnh quy tụ dàn mỹ nhân Vbiz",2023-02-21T07:00:00
"ChatGPT phong luôn Hoàng Thùy Linh, Đông Nhi, Bích Phương làm diva Việt Nam, có gì đó sai sai?",2023-02-20T08:00:00
Audi R8 từng của Đông Nhi và Ông Cao Thắng sau 6 năm qua tay 6 đời chủ nhưng trông ngày càng chất,2023-02-15T13:00:00
"Yêu nhau 14 năm, đây là món quà của Ông Cao Thắng khiến Đông Nhi ""sốc"" nhất vào dịp 14/2",2023-02-15T00:05:00
"Valentine thêm nhộn nhịp: Đông Nhi - Ông Cao Thắng kỷ niệm 14 năm bên nhau, Kai Đinh và Orange tung MV yêu đồng giới",2023-02-12T09:04:41
"Vbiz bỗng rộn ràng: Đỗ Mỹ Linh, Đông Nhi, Hari Won cùng lúc vướng nghi vấn có ""tin vui"" khi có chung dấu hiệu này",2023-02-07T17:49:00
"Khi chị em xương máu đụng hàng: Mẹ 3 con Phạm Quỳnh Anh liệu có lấn át Đông Nhi - Diệu Nhi nhờ ưu điểm ""khét lẹt""?",2023-02-07T16:30:00
"Đông Nhi - Phạm Quỳnh Anh đọ sắc chung một khung hình, nhưng 2 nhóc tì mới là nhân vật ""chiếm spotlight""",2023-02-02T16:52:00
Biểu cảm đáng yêu của con gái Đông Nhi và dàn nhóc tì sao Việt khi du lịch đầu năm,2023-01-31T09:51:00
"Fan ruột ""khóc hết nước mắt"" khi gặp Đông Nhi, dân tình xúc động vẫn không quên ""cà khịa"" chuyện năm xưa",2023-01-03T14:31:00
"Thực tập sinh người Việt tại show Hàn Quốc hoá ra là học trò Đông Nhi, 6 năm trước đã gây chú ý!",2022-12-30T15:15:00
"Một thành viên Uni5 tuyên bố rời nhóm, cảm ơn tất cả mọi người nhưng trừ Đông Nhi!",2022-12-27T19:31:02
"Những màn khoe nhẫn gây sốt Vbiz: Diễm My 9X được cầu hôn trên khinh khí cầu, Đông Nhi - Ông Cao Thắng ""đánh úp"" với nhẫn gần 3 tỷ đồng",2022-12-27T00:00:00
Bí mật đằng sau loạt ảnh thân thiết giữa Đỗ Khánh Vân và gà cưng của Đông Nhi,2022-12-15T10:00:00
"Đông Nhi và Bích Phương ""đọ sắc"", nghệ sĩ quốc tế xúc động trước tình cảm của khán giả Việt Nam!",2022-12-12T13:59:00
"Đông Nhi chỉ cách xử lí khi lỡ bắt gặp người yêu đang chở cô gái khác, đền kính cho fan vì nhảy phụ hoạ quá sung",2022-11-26T11:30:00
Gia đình Đông Nhi - Ông Cao Thắng chính thức trở thành đại sứ du lịch Nhật Bản,2022-11-16T19:30:00
"Hôn nhân của Đông Nhi - Ông Cao Thắng: Loạt khoảnh khắc gây bão, thốt lên 2 chữ trong kỷ niệm ngày cưới",2022-11-09T16:42:00
"""Đôi bạn cùng khổ"" Đông Nhi - Noo Phước Thịnh: Người ra MV thành tích lẹt đẹt, người bị tắt tiếng",2022-11-02T14:05:00
"Đông Nhi, Trọng Hiếu và Hà Nhi hội ngộ tại sự kiện ""có một không hai"" trong tháng 10",2022-10-27T13:30:00
"""Những lần đầu tiên"" - Món quà cho những ai làm mẹ lần đầu từ Đông Nhi và Similac",2022-10-27T09:00:00
"Karik, Đông Nhi và hội ""u mê"" các thiên thần nhỏ",2022-10-23T09:00:00
"Sao Việt trong ngày bạn thân lên xe hoa: Noo Phước Thịnh và Đông Nhi ""gây sốt"", Khả Như khóc nức nở",2022-10-21T16:27:00
"Đông Nhi mừng sinh nhật bên Minh Hằng, Mai Phương Thúy sau ồn ào vắng mặt tại đám cưới Diệu Nhi",2022-10-15T21:33:00
Thế khó của Đông Nhi khi Diệu Nhi tiếp tục tổ chức lễ cưới ở Hà Nội,2022-10-12T19:06:00
Đám cưới MC Liêu Hà Trinh tại TP.HCM: Nhã Phương và vợ chồng Đông Nhi cùng dàn sao đổ bộ,2022-10-11T00:16:00
Học trò Đông Nhi đang chinh chiến ra sao tại Sàn Đấu Vũ Đạo mùa 2?,2022-10-05T10:19:00
"MONO có tiến bộ, Đông Nhi tung luôn ca khúc mới trên sân khấu Chung kết Hoa hậu",2022-10-02T08:29:00
"Đông Nhi, Bích Phương sẽ trình diễn trong đêm chung kết Miss Grand Vietnam 2022",2022-09-29T15:52:00
"Đông Nhi diện đầm ngắn khoe chân dài, khuấy động sân khấu âm nhạc",2022-09-28T17:00:00
"Làm mới hit của Đông Nhi, tân binh Vote For Five gây tranh cãi",2022-09-19T13:19:00
"Winnie nhà Đông Nhi bị mẹ ""bóc phốt"" vì nghịch ngợm, phản ứng của Trương Mỹ Nhân gây chú ý",2022-08-23T15:23:00
Con gái Đông Nhi - Ông Cao Thắng hờn dỗi vì bố mẹ mải tình tứ,2022-08-09T16:16:00
"Khi Đông Nhi, Trúc Nhân và Isaac so kè quãng giọng, khán giả đồng lòng: Trao cúp cho Trúc Nhân luôn đi!",2022-07-29T17:25:00
"Đông Nhi, Karik, Hồ Quang Hiếu khuấy động đêm tiệc Top White Best Awards Of The Year 2022",2022-07-27T17:30:00
"Đông Nhi chia sẻ về lý do Uni5 và LipB không thành công, Isaac muốn tạo nên 1 nhóm nhạc ""đỉnh hơn 365""",2022-07-26T06:43:00
"Tập 1 Sàn Đấu Vũ Đạo 2022: Đông Nhi xúc động tự hào khi gặp lại ""học trò nhí"" Kellie",2022-07-24T14:10:00
"Netizen ""sửng sốt"" khi Trúc Nhân, Đông Nhi và Isaac quyết ""sống còn"" với nhau",2022-07-23T20:38:00
